{
"$schema": "https://json-schema.org/draft/2020-12/schema",
"$id": "schemas/context/get-context-response.schema.json",
"title": "Get Context Response",
"description": "Public response schema for get_context. This schema follows the actual public response shape returned by the workflow: a list of retrieved text blocks from the archive context layer.",
"type": "object",
"additionalProperties": false,
"required": [
"success",
"result_count",
"results",
"meta",
"message"
],
"properties": {
"success": {
"type": "boolean",
"description": "Indicates whether the context retrieval request completed successfully."
},
"result_count": {
"type": "integer",
"minimum": 0,
"description": "Number of retrieved text blocks returned."
},
"results": {
"type": "array",
"description": "Retrieved archive context blocks. Public examples may truncate long content for readability while preserving the actual response shape.",
"items": {
"type": "object",
"additionalProperties": false,
"required": [
"clean_text"
],
"properties": {
"clean_text": {
"type": "string",
"description": "Text content returned from the archive context retrieval workflow. Empty strings may occur when the source block is empty or structural."
}
}
}
},
"meta": {
"type": "object",
"additionalProperties": false,
"required": [
"source",
"scenario"
],
"properties": {
"source": {
"type": "string",
"minLength": 1,
"description": "Public source label for the archive context source."
},
"scenario": {
"type": "string",
"minLength": 1,
"description": "Workflow scenario label."
}
}
},
"message": {
"type": [
"string",
"null"
],
"description": "Optional human-readable response message."
}
}
}
